{"SchemaVersion":1,"ArtifactKind":"pending-prune-plan","PlanPayload":{"WorktreeNamespace":"aaaaaaaaaaaaaaaaaaaaaaaaaaaaaaaaaaaaaaaaaaaaaaaaaaaaaaaaaaaaaaaa","SelectionTimestampUtc":"2026-08-11T00:00:00.0000000Z","RegistrySnapshotHash":"bbbbbbbbbbbbbbbbbbbbbbbbbbbbbbbbbbbbbbbbbbbbbbbbbbbbbbbbbbbbbbbb","Items":[{"Path":"C:\\git-private\\preview.json","ContentHash":"cccccccccccccccccccccccccccccccccccccccccccccccccccccccccccccccc"}]},"PlanHash":"dddddddddddddddddddddddddddddddddddddddddddddddddddddddddddddddd","DocumentHash":"eeeeeeeeeeeeeeeeeeeeeeeeeeeeeeeeeeeeeeeeeeeeeeeeeeeeeeeeeeeeeeee"}
